Job Title,Salary Estimate,Job Description,Rating,Company Name,Location,Headquarters,Size,Founded,Type of ownership,Industry,Sector,Revenue,Competitors,hourly,employer_provided,min_salary,max_salary,avg_salary,company_txt,job_state,same_state,age,python_yn,R_yn,spark,aws,excel
Data Scientist,$88K-$140K (Glassdoor est.),"Every Analyst a Scientist - One of our primary goals is to empower intelligence analysts to be able to study their data like scientists. The tools we develop focus on streamlining intelligence analysis through integrated algorithms and software that provide insight into the geopolitical landscape for use in operational intelligence missions around the world.

The Role:

As a Data Scientist, you will live by our motto that “Data is Destiny.” You will work with a diverse collection of massive datasets, including social media, structured and unstructured text, geospatial, time series, and imagery data. You will design, test, and validate statistical tests and machine learning models in support of cutting-edge problems in the national security space. Your expertise as a data scientist will aid a diverse team of researchers to build state-of-the-art tools and technologies that are deployed to extract and enrich intelligence used by analysts.

If you would like to help intelligence and defense analysts keep pace with technology-driven innovation, then this role is for you!

Who you are:
A U.S. Citizen with the ability to obtain a Security Clearance
A degree in a scientific field such as Statistics, Mathematics, or Computer Science
Experience in statistical modeling including performance evaluation and uncertainty quantification
Proficiency with a scientific programming language, preferably Python, and familiarity with Numpy, Pandas, and/or Scikit-learn packages
Experience in grooming sparse, incomplete, and noisy datasets
Motivated collaborator who is an excellent communicator of ideas to both technical and non-technical audiences
Even better:
Active Clearance
MS or PhD in a scientific field such as Statistics, Mathematics, Computer Science, or Data Science or 2+ years of relevant work experience
Familiarity with handling and analyzing data at scale, for example using Hadoop, Dask, Spark, and MapReduce
Working knowledge of data store tools such as SQL and Elasticsearch, and experience interacting with databases
Experience with deep learning and neural network training, testing, and evaluation with fluency in Tensorflow or PyTorch
Specialized expertise in a data-rich field such as time-series analysis, graph analytics, geospatial analysis, image processing, or Bayesian programming",4.5,"Systems & Technology Research
4.5","Woburn, MA",-1,201 to 500 Employees,2010,Company - Private,Aerospace & Defense,Aerospace & Defense,$100 to $500 million (USD),-1,0,0,88,140,114.0,"Systems & Technology Research
", MA,0,10,1,0,1,0,1
Senior Data Scientist,$88K-$140K (Glassdoor est.),"NanoMosaic LLC, located in Woburn, Massachusetts, is focused on developing an innovative photonics technology for biomedical diagnostics and drug development. Our cutting-edge technology will enable new frontiers of medical research for ultrahigh-sensitivity detection of single molecules in low volume liquid biopsy samples.
We are looking for a candidate with a strong desire to bring a disruptive technology to market; playing a key role in a multidisciplinary team. This position will primarily focus on implementation of our data processing, informatics, and reporting pipeline.
Successful candidates must have solid knowledge and extensive experience with scripting in Python or similar language with special emphasis in machine vision applications. Emphasis is also placed on image processing techniques via machine learning methods as well as local and hosted system architecture development. Experience providing consumer-facing data visualizations is preferred. Additionally, candidates should possess a strong acumen for on-the-fly problem solving, communication, and system level thinking.

Responsibilities:
Develop, validate, implement, and support image analysis tools for our evolving data pipeline
Incorporate data pipeline revisions into our existing platform
Develop and integrate data reporting mechanism
General Qualifications:
Creative, hardworking, and organized. Must also show a track record of innovative problem solving in technical environments.
BS/BA degree in a Data Science or related field (e.g. Computer Science, Statistics, Mathematics, Bioinformatics, etc.)
5+ years of directly related experience
Strong experience with image processing and image analysis
Strong background in Python
Strong problem-solving skills
Ability to prioritize tasks and remain agile in a small working group
Excellent communication skills are essential
Preferred Qualifications:
Master’s degree in a Data Science or related field (e.g. Computer Science, Statistics, Mathematics, Bioinformatics, etc.) plus 5 years of experience.
Previous experience in application of statistical methods and machine learning techniques
Experience with wet-lab techniques (especially immunological)
Application experience with photonics, machine vision, and microscopy
Experience with laboratory automation including liquid handling, plate readers, plate washers, and incubators
Experience with other software platforms such as LabView, Matlab
Familiarity with regulatory framework and guidance for RUO and Dx software development

NanoMosaic LLC. is an equal opportunity employer and all qualified applicants will receive consideration for employment without regard to race, color, religion, sex, national origin, disability status, protected veteran status, or any other characteristic protected by law.",-1.0,NanoMosaic,"Woburn, MA",-1,Unknown,-1,Unknown,-1,-1,Less than $1 million (USD),-1,0,0,88,140,114.0,NanoMosaic, MA,0,-1,1,0,0,0,1
Senior Business Intelligence Analyst,$88K-$140K (Glassdoor est.),"Position Overview:

The Senior Business Intelligence Analyst is responsible for turning data into knowledge, enabling business decisions.

Specific Duties Include:
Partnering with the user community to create new business intelligence, reporting and data analysis solutions.
Maintaining existing software systems related to business intelligence, reporting and data analysis.
Identify improvements to existing business intelligence, reporting and data analysis.
Capture, develop, and document data definitions, business rules, and data quality requirements.
Build and maintain ETL (Extract, Transform, Load) and integration processes.
Validate data delivered to user community.
Ensure compliance with Protolabs data and software policies and procedures.
Monitor software systems to ensure reliability and accuracy of information loaded into the databases.
Maintain all documentation related to database objects, source systems, and operations.
Conduct complex, important work under minimal supervision and with wide latitude for independent judgment.
Minimum Qualifications:
6+ years of experience working in software engineering
Experience with Microsoft SQL Server
Experience with Domo
Experience with PowerBI
Experience with Microsoft SQL Server Reporting Service (SSRS)
Ability to work on multiple project concurrently
Ability to manage time effectively
Strong written and verbal communication skills
Ability to work effectively in a fast paced, collaborative environment
Education Requirements:
Bachelor’s Degree in Computer Science, Software Engineering, or related field
Preferred Qualifications:
Previous leadership experience preferred
Knowledge of document databases including Raven
Previous experience with Microsoft Dynamics AX
Previous experience with Salesforce
Software development in a continuous integration and continuous deployment environment
Proto Labs maintains ITAR-compliant operations in all of our United States based facilities. Due to ITAR regulations, this role is only open to U.S. Citizens, lawful permanent residents (green card holders) or foreign nationals granted refugee or asylee status. Individuals with temporary visas (e.g. E, F-1, H-1, H-2, L, B, J, TN or OPT) are not eligible for hire in this role.

Proto Labs, Inc. is an Affirmative Action / Equal Opportunity Employer",3.7,"Protolabs
3.7","Morrisville, NC",-1,1001 to 5000 Employees,1999,Company - Public,Miscellaneous Manufacturing,Manufacturing,$100 to $500 million (USD),-1,0,0,88,140,114.0,"Protolabs
", NC,0,21,0,0,0,0,0
